{
 "_doc": "Số hạt nguyên tố Kỹ năng Nguyên tố của từng nhân vật tạo ra, đúng như Genshin Impact Wiki ghi ({{Talent Note|particles|...}} trên trang kỹ năng). SINH TỰ ĐỘNG bằng scripts/sync-abyss-particles.py — đừng sửa tay. `notes` là tham số template nguyên văn; `readings` là cách đọc: press/hold = hạt mỗi lần dùng, perEvent = hạt mỗi SỰ KIỆN (mỗi đòn của Oz, mỗi hơi của Guoba) — số sự kiện mỗi lần dùng là tri thức kit, nằm ở character-kits.json → energy.eventsPerCast. `notes` rỗng = trang không có ghi chú, số hạt phải bổ sung ở character-kits.json → energy.particlesPerCast kèm nguồn. Số liệu do cộng đồng đo, không phải file game; gcsim (github.com/genshinsim/gcsim) dùng để đối chiếu.",
 "source": "genshin-impact.fandom.com/api.php?action=parse — trang Elemental Skill theo tên trong talent-params.json",
 "fetchedOn": "2026-09-15",
 "characters": {
  "aino": {
   "page": "Musecatcher",
   "revid": 2127100,
   "notes": [
    [
     "3"
    ]
   ],
   "readings": [
    {
     "press": 3.0
    }
   ]
  },
  "albedo": {
   "page": "Abiogenesis: Solar Isotoma",
   "revid": 1740599,
   "notes": [
    [
     "a Transient Blossom",
     "0.67"
    ]
   ],
   "readings": [
    {
     "perEvent": {
      "event": "a Transient Blossom",
      "count": 0.67
     }
    }
   ]
  },
  "alhaitham": {
   "page": "Universality: An Elaboration on Form",
   "revid": 1764228,
   "notes": [
    [
     "a Projection Attack",
     "1"
    ]
   ],
   "readings": [
    {
     "perEvent": {
      "event": "a Projection Attack",
      "count": 1.0
     }
    }
   ]
  },
  "aloy": {
   "page": "Frozen Wilds",
   "revid": 1759469,
   "notes": [
    [
     "5"
    ]
   ],
   "readings": [
    {
     "press": 5.0
    }
   ]
  },
  "alyosha": {
   "page": "Thunderbolt Strike",
   "revid": 2172334,
   "notes": [
    [
     "5"
    ]
   ],
   "readings": [
    {
     "press": 5.0
    }
   ]
  },
  "amber": {
   "page": "Explosive Puppet",
   "revid": 1676903,
   "notes": [
    [
     "the explosion",
     "4"
    ]
   ],
   "readings": [
    {
     "perEvent": {
      "event": "the explosion",
      "count": 4.0
     }
    }
   ]
  },
  "arataki-itto": {
   "page": "Masatsu Zetsugi: Akaushi Burst!",
   "revid": 1683193,
   "notes": [
    [
     "3.5"
    ]
   ],
   "readings": [
    {
     "press": 3.5
    }
   ]
  },
  "arlecchino": {
   "page": "All Is Ash",
   "revid": 2064918,
   "notes": [
    [
     "5"
    ]
   ],
   "readings": [
    {
     "press": 5.0
    }
   ]
  },
  "baizhu": {
   "page": "Universal Diagnosis",
   "revid": 1764576,
   "notes": [
    [
     "3.5"
    ]
   ],
   "readings": [
    {
     "press": 3.5
    }
   ]
  },
  "barbara": {
   "page": "Let the Show Begin♪",
   "revid": 1864476,
   "notes": [
    [
     "0"
    ]
   ],
   "readings": [
    {
     "press": 0.0
    }
   ]
  },
  "beidou": {
   "page": "Tidecaller",
   "revid": 1859051,
   "notes": [],
   "readings": []
  },
  "bennett": {
   "page": "Passion Overload",
   "revid": 1677166,
   "notes": [
    [
     "2.25",
     "3"
    ]
   ],
   "readings": [
    {
     "press": 2.25,
     "hold": 3.0
    }
   ]
  },
  "candace": {
   "page": "Sacred Rite: Heron's Sanctum",
   "revid": 2051034,
   "notes": [
    [
     "2",
     "3"
    ]
   ],
   "readings": [
    {
     "press": 2.0,
     "hold": 3.0
    }
   ]
  },
  "charlotte": {
   "page": "Framing: Freezing Point Composition",
   "revid": 1771073,
   "notes": [],
   "readings": []
  },
  "chasca": {
   "page": "Spirit Reins, Shadow Hunt",
   "revid": 2136125,
   "notes": [
    [
     "a Converted Charged Attack",
     "5"
    ]
   ],
   "readings": [
    {
     "perEvent": {
      "event": "a Converted Charged Attack",
      "count": 5.0
     }
    }
   ]
  },
  "chevreuse": {
   "page": "Short-Range Rapid Interdiction Fire",
   "revid": 2094147,
   "notes": [
    [
     "4"
    ]
   ],
   "readings": [
    {
     "press": 4.0
    }
   ]
  },
  "chiori": {
   "page": "Fluttering Hasode",
   "revid": 1777327,
   "notes": [
    [
     "Tamoto DMG",
     "1.2"
    ]
   ],
   "readings": [
    {
     "perEvent": {
      "event": "Tamoto DMG",
      "count": 1.2
     }
    }
   ]
  },
  "chongyun": {
   "page": "Spirit Blade: Chonghua's Layered Frost",
   "revid": 1677071,
   "notes": [
    [
     "4"
    ]
   ],
   "readings": [
    {
     "press": 4.0
    }
   ]
  },
  "citlali": {
   "page": "Dawnfrost Darkstar",
   "revid": 2115692,
   "notes": [
    [
     "Obsidian Tzitzimitl DMG",
     "5"
    ]
   ],
   "readings": [
    {
     "perEvent": {
      "event": "Obsidian Tzitzimitl DMG",
      "count": 5.0
     }
    }
   ]
  },
  "clorinde": {
   "page": "Hunter's Vigil",
   "revid": 1892122,
   "notes": [
    [
     "Swift Hunt or Impale the Night",
     "1"
    ]
   ],
   "readings": [
    {
     "perEvent": {
      "event": "Swift Hunt or Impale the Night",
      "count": 1.0
     }
    }
   ]
  },
  "collei": {
   "page": "Floral Brush",
   "revid": 1759165,
   "notes": [
    [
     "2.5"
    ]
   ],
   "readings": [
    {
     "press": 2.5
    }
   ]
  },
  "columbina": {
   "page": "Eternal Tides",
   "revid": 2049988,
   "notes": [
    [
     "1.3333333"
    ]
   ],
   "readings": [
    {
     "press": 1.3333333
    }
   ]
  },
  "cyno": {
   "page": "Secret Rite: Chasmic Soulfarer",
   "revid": 2124119,
   "notes": [
    [
     "Skill DMG",
     "3"
    ],
    [
     "Mortuary Rite DMG",
     "1.333"
    ]
   ],
   "readings": [
    {
     "perEvent": {
      "event": "Skill DMG",
      "count": 3.0
     }
    },
    {
     "perEvent": {
      "event": "Mortuary Rite DMG",
      "count": 1.333
     }
    }
   ]
  },
  "dahlia": {
   "page": "Immersive Ordinance",
   "revid": 1834102,
   "notes": [
    [
     "Skill DMG",
     "3"
    ]
   ],
   "readings": [
    {
     "perEvent": {
      "event": "Skill DMG",
      "count": 3.0
     }
    }
   ]
  },
  "dehya": {
   "page": "Molten Inferno",
   "revid": 1865452,
   "notes": [
    [
     "a coordinated attack",
     "1"
    ]
   ],
   "readings": [
    {
     "perEvent": {
      "event": "a coordinated attack",
      "count": 1.0
     }
    }
   ]
  },
  "diluc": {
   "page": "Searing Onslaught",
   "revid": 1677050,
   "notes": [
    [
     "1.33"
    ]
   ],
   "readings": [
    {
     "press": 1.33
    }
   ]
  },
  "diona": {
   "page": "Icy Paws",
   "revid": 1887297,
   "notes": [
    [
     "an Icy Paw",
     "~0.8"
    ]
   ],
   "readings": [
    {
     "perEvent": {
      "event": "an Icy Paw",
      "count": 0.8
     }
    }
   ]
  },
  "dori": {
   "page": "Spirit-Warding Lamp: Troubleshooter Cannon",
   "revid": 1684549,
   "notes": [
    [
     "2"
    ]
   ],
   "readings": [
    {
     "press": 2.0
    }
   ]
  },
  "durin": {
   "page": "Binary Form: Convergence and Division",
   "revid": 2155356,
   "notes": [
    [
     "4"
    ]
   ],
   "readings": [
    {
     "press": 4.0
    }
   ]
  },
  "emilie": {
   "page": "Fragrance Extraction",
   "revid": 1778962,
   "notes": [
    [
     "Level 1/2 Lumidouce Case Attack DMG",
     "1"
    ]
   ],
   "readings": [
    {
     "perEvent": {
      "event": "Level 1/2 Lumidouce Case Attack DMG",
      "count": 1.0
     }
    }
   ]
  },
  "escoffier": {
   "page": "Low-Temperature Cooking",
   "revid": 1763702,
   "notes": [
    [
     "Skill DMG",
     "4"
    ]
   ],
   "readings": [
    {
     "perEvent": {
      "event": "Skill DMG",
      "count": 4.0
     }
    }
   ]
  },
  "eula": {
   "page": "Icetide Vortex",
   "revid": 1681958,
   "notes": [
    [
     "1.5",
     "2.5"
    ]
   ],
   "readings": [
    {
     "press": 1.5,
     "hold": 2.5
    }
   ]
  },
  "faruzan": {
   "page": "Wind Realm of Nasamjnin",
   "revid": 1765023,
   "notes": [
    [
     "Pressurized Collapse",
     "2"
    ]
   ],
   "readings": [
    {
     "perEvent": {
      "event": "Pressurized Collapse",
      "count": 2.0
     }
    }
   ]
  },
  "fischl": {
   "page": "Nightrider",
   "revid": 1887327,
   "notes": [
    [
     "each of Oz's attacks",
     "0.67"
    ]
   ],
   "readings": [
    {
     "perEvent": {
      "event": "each of Oz's attacks",
      "count": 0.67
     }
    }
   ]
  },
  "flins": {
   "page": "Ancient Rite: Arcane Light",
   "revid": 2055541,
   "notes": [
    [
     "a converted Normal Attack",
     "1"
    ]
   ],
   "readings": [
    {
     "perEvent": {
      "event": "a converted Normal Attack",
      "count": 1.0
     }
    }
   ]
  },
  "freminet": {
   "page": "Pressurized Floe",
   "revid": 1764143,
   "notes": [],
   "readings": []
  },
  "furina": {
   "page": "Salon Solitaire",
   "revid": 2136445,
   "notes": [
    [
     "a Salon Member's attack",
     "1"
    ]
   ],
   "readings": [
    {
     "perEvent": {
      "event": "a Salon Member's attack",
      "count": 1.0
     }
    }
   ]
  },
  "gaming": {
   "page": "Bestial Ascent",
   "revid": 2163058,
   "notes": [
    [
     "Plunging Attack: Charmed Cloudstrider",
     "2"
    ]
   ],
   "readings": [
    {
     "perEvent": {
      "event": "Plunging Attack: Charmed Cloudstrider",
      "count": 2.0
     }
    }
   ]
  },
  "ganyu": {
   "page": "Trail of the Qilin",
   "revid": 1741894,
   "notes": [],
   "readings": []
  },
  "gorou": {
   "page": "Inuzaka All-Round Defense",
   "revid": 1854307,
   "notes": [
    [
     "2"
    ]
   ],
   "readings": [
    {
     "press": 2.0
    }
   ]
  },
  "hu-tao": {
   "page": "Guide to Afterlife",
   "revid": 1681859,
   "notes": [
    [
     "a converted attack",
     "2.5"
    ]
   ],
   "readings": [
    {
     "perEvent": {
      "event": "a converted attack",
      "count": 2.5
     }
    }
   ]
  },
  "iansan": {
   "page": "Thunderbolt Rush",
   "revid": 2136127,
   "notes": [
    [
     "Skill DMG",
     "4"
    ]
   ],
   "readings": [
    {
     "perEvent": {
      "event": "Skill DMG",
      "count": 4.0
     }
    }
   ]
  },
  "ifa": {
   "page": "Airborne Disease Prevention",
   "revid": 2136128,
   "notes": [
    [
     "Tonicshot",
     "~4.3"